{
  "slug": "IDENTITY_VOUCHED_BY__sigstore_core",
  "name": "Identity Vouched By",
  "description": "The signing identity recorded in this Rekor entry was vouched for by an OIDC issuer — Fulcio bound the short-lived signing cert to an identity from this issuer. Hotlink-backed (mode exact): the edge's hotlink.value mirrors rekor_log_entry.signing_identity_issuer, so the edge cannot drift from the field. Converges with the AWS federation path on the same oidc_issuer node.",
  "sources": ["sigstore_core__rekor_log_entry"],
  "targets": ["github_core__oidc_issuer"],
  "default_dimensions": {
    "sigstore.platform": "public-good"
  }
}
