{
  "slug": "AVAILABLE_AT__computing_core",
  "name": "Available At",
  "description": "A port is available at an IP address, even when the concrete interface is not known.",
  "sources": [
    "computing_core__port"
  ],
  "targets": [
    "computing_core__ip_address"
  ],
  "default_dimensions": {
    "tap.computing": "network"
  }
}
