{
  "slug": "RESIDES_IN__aws_core",
  "name": "Resides In",
  "description": "Resource lives in a region, availability zone, VPC, or subnet.",
  "sources": [
    "aws_core__aws_ec2_instance",
    "aws_core__aws_lambda",
    "aws_core__aws_ecs_cluster",
    "aws_core__aws_ecs_service",
    "aws_core__aws_ecs_task",
    "aws_core__aws_eks_cluster",
    "aws_core__aws_rds_instance",
    "aws_core__aws_elasticache_cluster",
    "aws_core__aws_elasticsearch_domain",
    "aws_core__aws_nat_gateway",
    "aws_core__aws_alb",
    "aws_core__aws_elb",
    "aws_core__aws_network_firewall",
    "aws_core__aws_sagemaker_endpoint",
    "aws_core__aws_subnet"
  ],
  "targets": [
    "aws_core__aws_region",
    "aws_core__aws_az",
    "aws_core__aws_vpc",
    "aws_core__aws_subnet"
  ],
  "default_dimensions": {
    "tap.cloud": "aws"
  }
}
