{
  "slug": "HOSTS_ACCOUNT__github_core",
  "name": "Hosts Account",
  "description": "The GitHub platform instance (github.com or a GHES host) hosts an account. Top-of-tree containment edge: github_platform → github_account, parent → child. Synthesized by the collector alongside the platform singleton; the projection nests the account compound inside the platform compound by walking this edge.",
  "sources": ["github_platform"],
  "targets": ["github_account"],
  "default_dimensions": {
    "github.platform": "github.com"
  }
}
