{
  "slug": "EXPOSES_NETWORK_ACCESS__aws_core",
  "name": "Exposes Network Access",
  "description": "Security group or load balancer exposes network access through ports or endpoints.",
  "sources": [
    "aws_core__aws_security_group",
    "aws_core__aws_alb",
    "aws_core__aws_elb"
  ],
  "property_schema": {
    "type": "object",
    "properties": {
      "port": {
        "type": "integer"
      },
      "protocol": {
        "type": "string"
      },
      "cidr": {
        "type": "string",
        "description": "Source/destination CIDR for the exposure."
      }
    }
  },
  "default_dimensions": {
    "tap.cloud": "aws"
  }
}
