{
  "slug": "MENTORS__lotr",
  "name": "Mentors",
  "description": "One character mentors another.",
  "sources": ["lotr__character"],
  "targets": ["lotr__character"],
  "property_schema": {
    "type": "object",
    "required": ["discipline"],
    "properties": {
      "discipline": {"type": "string"},
      "duration_years": {"type": "integer", "minimum": 0}
    },
    "additionalProperties": false
  }
}
