{
  "slug": "HAS_JOB",
  "name": "Has Job",
  "description": "Run contains a job. v0 reflects the latest-attempt job set (multi-attempt deferred to req-github-core-backlog-run-attempts).",
  "sources": ["github_actions_run"],
  "targets": ["github_actions_job"],
  "default_dimensions": {
    "github.platform": "github.com",
    "github.surface": "actions",
    "github.observation": "execution"
  }
}
