{
  "slug": "CONTAINS__aws_core",
  "name": "Contains",
  "description": "Parent resource contains child resources (VPC contains subnets, ECS cluster contains services, etc.).",
  "sources": [
    "aws_core__aws_vpc",
    "aws_core__aws_ecs_cluster",
    "aws_core__aws_region",
    "aws_core__aws_route53_zone"
  ],
  "targets": [
    "aws_core__aws_subnet",
    "aws_core__aws_ecs_service",
    "aws_core__aws_az",
    "aws_core__aws_vpc"
  ],
  "default_dimensions": {
    "tap.cloud": "aws"
  }
}
